{
  "$schema": "https://json-schema.org/draft/2020-12/schema",
  "$id": "https://leanprover.github.io/lean-vir/schemas/binding-library-v2.json",
  "title": "Lean VIR binding library",
  "type": "object",
  "additionalProperties": false,
  "required": ["version", "id", "title", "description", "lean", "generation", "roots"],
  "properties": {
    "$schema": { "type": "string" },
    "version": { "const": 2 },
    "id": { "$ref": "#/$defs/id" },
    "title": { "type": "string", "minLength": 1 },
    "description": { "type": "string", "minLength": 1 },
    "lean": {
      "type": "object",
      "additionalProperties": false,
      "required": ["modules"],
      "properties": {
        "modules": {
          "type": "array",
          "minItems": 1,
          "uniqueItems": true,
          "items": { "type": "string", "minLength": 1 }
        }
      }
    },
    "generation": { "$ref": "#/$defs/generation" },
    "roots": {
      "type": "array",
      "minItems": 1,
      "items": { "$ref": "#/$defs/root" }
    }
  },
  "$defs": {
    "id": { "type": "string", "pattern": "^[a-z0-9]+(?:-[a-z0-9]+)*$" },
    "generation": {
      "type": "object",
      "additionalProperties": false,
      "required": ["output", "imports", "namespace", "abiProfile", "resources"],
      "properties": {
        "output": { "type": "string", "minLength": 1 },
        "imports": {
          "type": "array",
          "minItems": 1,
          "uniqueItems": true,
          "items": { "type": "string", "minLength": 1 }
        },
        "namespace": { "type": "string", "minLength": 1 },
        "abiProfile": { "$ref": "#/$defs/abiProfile" },
        "resources": {
          "type": "object",
          "additionalProperties": { "$ref": "#/$defs/resourceMapping" }
        },
        "methodPolicies": {
          "type": "object",
          "additionalProperties": { "$ref": "#/$defs/methodPolicy" }
        },
        "exceptions": {
          "type": "object",
          "additionalProperties": { "$ref": "#/$defs/generationException" }
        },
        "protocolOperations": {
          "type": "array",
          "uniqueItems": true,
          "items": { "$ref": "#/$defs/protocolOperation" }
        }
      }
    },
    "protocolOperation": {
      "type": "object",
      "additionalProperties": false,
      "required": ["id", "group", "target", "lean", "marker", "reason", "upstreamRelation", "effect", "arguments", "result"],
      "properties": {
        "id": { "type": "string", "minLength": 1 },
        "group": { "$ref": "#/$defs/id" },
        "target": { "type": "string", "minLength": 1 },
        "lean": { "type": "string", "minLength": 1 },
        "marker": { "enum": ["vir_js", "vir_js_explicit_conversion"] },
        "visibility": { "enum": ["public", "private"] },
        "reason": { "type": "string", "minLength": 1 },
        "upstreamRelation": { "$ref": "#/$defs/protocolUpstreamRelation" },
        "activeEffect": { "enum": ["register", "use", "release"] },
        "documentation": { "type": "string", "minLength": 1 },
        "typeParameters": {
          "type": "array",
          "uniqueItems": true,
          "items": { "type": "string", "minLength": 1 }
        },
        "proofParameters": {
          "type": "array",
          "uniqueItems": true,
          "items": { "type": "string", "minLength": 1 }
        },
        "effect": {
          "type": "object",
          "additionalProperties": false,
          "required": ["id", "lean"],
          "properties": {
            "id": { "type": "string", "minLength": 1 },
            "lean": { "type": "string", "minLength": 1 }
          }
        },
        "arguments": {
          "type": "array",
          "items": { "$ref": "#/$defs/protocolArgument" }
        },
        "result": { "$ref": "#/$defs/protocolResult" }
      }
    },
    "protocolUpstreamRelation": {
      "oneOf": [
        {
          "type": "object",
          "additionalProperties": false,
          "required": ["kind"],
          "properties": { "kind": { "const": "vir-owned" } }
        },
        {
          "type": "object",
          "additionalProperties": false,
          "required": ["kind", "member"],
          "properties": {
            "kind": { "const": "local-contract" },
            "member": { "type": "string", "minLength": 1 }
          }
        },
        {
          "type": "object",
          "additionalProperties": false,
          "required": ["kind", "member"],
          "properties": {
            "kind": { "const": "upstream-adapter" },
            "member": { "type": "string", "minLength": 1 },
            "accessor": { "enum": ["get", "set"] },
            "semantics": { "$ref": "#/$defs/upstreamSemantics" }
          }
        },
        {
          "type": "object",
          "additionalProperties": false,
          "required": ["kind"],
          "properties": { "kind": { "const": "unclassified" } }
        }
      ]
    },
    "protocolArgument": {
      "type": "object",
      "additionalProperties": false,
      "required": ["name", "type"],
      "properties": {
        "name": { "type": "string", "minLength": 1 },
        "role": { "enum": ["receiver", "argument", "callback"] },
        "type": { "$ref": "#/$defs/leanTypeOverride" },
        "passing": { "enum": ["borrowed", "owned", "consumed"] },
        "retention": { "enum": ["call", "until-release", "runtime"] }
      }
    },
    "protocolResult": {
      "type": "object",
      "additionalProperties": false,
      "required": ["type"],
      "properties": {
        "type": { "$ref": "#/$defs/leanTypeOverride" },
        "ownership": { "enum": ["owned", "borrowed"] }
      }
    },
    "methodPolicy": {
      "type": "object",
      "additionalProperties": false,
      "minProperties": 1,
      "dependentRequired": {
        "semantics": ["reason"],
        "reason": ["semantics"]
      },
      "properties": {
        "visibility": { "enum": ["public", "private"] },
        "signature": { "type": "integer", "minimum": 0 },
        "omittedOptionalParameters": {
          "type": "array",
          "uniqueItems": true,
          "items": { "type": "string", "minLength": 1 }
        },
        "forwardedOptionalParameters": {
          "type": "array",
          "uniqueItems": true,
          "items": { "type": "string", "minLength": 1 }
        },
        "omittedRequiredParameters": {
          "type": "array",
          "uniqueItems": true,
          "items": { "type": "string", "minLength": 1 }
        },
        "omittedRestParameters": {
          "type": "array",
          "uniqueItems": true,
          "items": { "type": "string", "minLength": 1 }
        },
        "fixedRestParameters": {
          "type": "object",
          "propertyNames": { "type": "string", "minLength": 1 },
          "additionalProperties": {
            "type": "array",
            "minItems": 1,
            "uniqueItems": true,
            "items": { "type": "string", "minLength": 1 }
          }
        },
        "fixedArguments": {
          "type": "object",
          "propertyNames": { "type": "string", "minLength": 1 },
          "additionalProperties": {
            "anyOf": [
              { "type": "string" },
              { "type": "number" },
              { "type": "boolean" }
            ]
          }
        },
        "parameterRenames": {
          "type": "object",
          "propertyNames": { "type": "string", "minLength": 1 },
          "additionalProperties": { "type": "string", "minLength": 1 }
        },
        "typeParameters": {
          "type": "array",
          "uniqueItems": true,
          "items": { "type": "string", "minLength": 1 }
        },
        "proofParameters": {
          "type": "array",
          "uniqueItems": true,
          "items": { "type": "string", "minLength": 1 }
        },
        "semantics": { "$ref": "#/$defs/upstreamSemantics" },
        "reason": { "type": "string", "minLength": 1 }
      }
    },
    "abiProfile": {
      "type": "object",
      "additionalProperties": false,
      "required": ["id", "effect", "types", "resource", "receiver"],
      "properties": {
        "id": { "type": "string", "minLength": 1 },
        "effect": {
          "type": "object",
          "additionalProperties": false,
          "required": ["id", "lean"],
          "properties": {
            "id": { "type": "string", "minLength": 1 },
            "lean": { "type": "string", "minLength": 1 }
          }
        },
        "types": {
          "type": "object",
          "minProperties": 1,
          "additionalProperties": {
            "type": "object",
            "additionalProperties": false,
            "required": ["lean", "representation"],
            "properties": {
              "lean": { "type": "string", "minLength": 1 },
              "representation": { "enum": ["immediate", "js-resource"] }
            }
          }
        },
        "resource": {
          "type": "object",
          "additionalProperties": false,
          "required": ["constructor", "nullableConstructor", "argument", "result"],
          "properties": {
            "constructor": { "type": "string", "minLength": 1 },
            "nullableConstructor": { "type": "string", "minLength": 1 },
            "undefinedOrConstructor": { "type": "string", "minLength": 1 },
            "argument": { "$ref": "#/$defs/passingRetention" },
            "result": {
              "type": "object",
              "additionalProperties": false,
              "required": ["ownership"],
              "properties": { "ownership": { "enum": ["owned", "borrowed"] } }
            }
          }
        },
        "receiver": {
          "type": "object",
          "additionalProperties": false,
          "required": ["default", "globalTypes"],
          "properties": {
            "default": { "$ref": "#/$defs/passingRetention" },
            "globalTypes": {
              "type": "object",
              "additionalProperties": { "$ref": "#/$defs/semanticPolicy" }
            }
          }
        }
      }
    },
    "passingRetention": {
      "type": "object",
      "additionalProperties": false,
      "required": ["passing", "retention"],
      "properties": {
        "passing": { "enum": ["borrowed", "owned", "consumed"] },
        "retention": { "enum": ["call", "until-release", "runtime"] }
      }
    },
    "modalityOverride": {
      "type": "object",
      "minProperties": 1,
      "additionalProperties": false,
      "properties": {
        "role": { "enum": ["argument", "callback"] },
        "passing": { "enum": ["borrowed", "owned", "consumed"] },
        "retention": { "enum": ["call", "until-release", "runtime"] },
        "type": { "$ref": "#/$defs/leanTypeOverride" }
      }
    },
    "receiverOverride": {
      "type": "object",
      "minProperties": 1,
      "additionalProperties": false,
      "properties": {
        "kind": { "enum": ["global", "argument", "none"] },
        "passing": { "enum": ["borrowed", "owned", "consumed"] },
        "retention": { "enum": ["call", "until-release", "runtime"] },
        "name": { "type": "string", "minLength": 1 },
        "type": { "$ref": "#/$defs/leanTypeOverride" }
      }
    },
    "leanTypeOverride": {
      "type": "object",
      "additionalProperties": false,
      "required": ["lean", "representation"],
      "properties": {
        "lean": { "type": "string", "minLength": 1 },
        "representation": { "enum": ["immediate", "lean-owned", "js-resource", "callback"] },
        "resourceInner": { "type": "string", "minLength": 1 }
      }
    },
    "semanticPolicy": {
      "type": "object",
      "additionalProperties": false,
      "required": ["semantics", "reason"],
      "properties": {
        "semantics": { "$ref": "#/$defs/upstreamSemantics" },
        "reason": { "type": "string", "minLength": 1 }
      }
    },
    "resourceMapping": {
      "oneOf": [
        { "type": "string", "minLength": 1 },
        {
          "type": "object",
          "additionalProperties": false,
          "required": ["lean", "semantics", "reason"],
          "properties": {
            "lean": { "type": "string", "minLength": 1 },
            "semantics": { "$ref": "#/$defs/upstreamSemantics" },
            "reason": { "type": "string", "minLength": 1 }
          }
        }
      ]
    },
    "generationException": {
      "type": "object",
      "additionalProperties": false,
      "required": ["reason"],
      "anyOf": [
        { "required": ["receiver"] },
        { "required": ["arguments"] },
        { "required": ["result"] },
        { "required": ["effect"] }
      ],
      "properties": {
        "reason": { "type": "string", "minLength": 1 },
        "activeEffect": { "enum": ["register", "use", "release"] },
        "semantics": { "$ref": "#/$defs/upstreamSemantics" },
        "receiver": { "$ref": "#/$defs/receiverOverride" },
        "arguments": {
          "type": "object",
          "minProperties": 1,
          "additionalProperties": { "$ref": "#/$defs/modalityOverride" }
        },
        "result": {
          "type": "object",
          "additionalProperties": false,
          "minProperties": 1,
          "properties": {
            "ownership": { "enum": ["owned", "borrowed"] },
            "type": { "$ref": "#/$defs/leanTypeOverride" }
          }
        },
        "effect": {
          "type": "object",
          "additionalProperties": false,
          "required": ["id", "lean"],
          "properties": {
            "id": { "type": "string", "minLength": 1 },
            "lean": { "type": "string", "minLength": 1 }
          }
        }
      }
    },
    "upstreamSemantics": {
      "enum": ["preserving", "changing"]
    },
    "root": {
      "type": "object",
      "additionalProperties": false,
      "required": ["id", "title", "targets", "upstream"],
      "properties": {
        "id": { "$ref": "#/$defs/id" },
        "title": { "type": "string", "minLength": 1 },
        "description": { "type": "string", "minLength": 1 },
        "targets": {
          "type": "array",
          "minItems": 1,
          "uniqueItems": true,
          "items": { "type": "string", "minLength": 1, "pattern": "^[^*]*(?:\\*)?$" }
        },
        "lean": {
          "type": "object",
          "additionalProperties": false,
          "properties": {
            "public": {
              "type": "array",
              "uniqueItems": true,
              "items": { "type": "string", "minLength": 1 }
            }
          }
        },
        "upstream": { "$ref": "#/$defs/upstream" },
        "mappings": {
          "type": "array",
          "items": {
            "oneOf": [
              { "$ref": "#/$defs/directMapping" },
              { "$ref": "#/$defs/propertyMapping" }
            ]
          }
        },
        "unsupported": {
          "type": "array",
          "uniqueItems": true,
          "items": { "$ref": "#/$defs/unsupportedEntry" }
        }
      }
    },
    "unsupportedEntry": {
      "type": "object",
      "additionalProperties": false,
      "required": ["typescript", "scope", "note"],
      "properties": {
        "typescript": { "type": "string", "minLength": 1 },
        "scope": { "enum": ["symbol", "surface"] },
        "note": { "type": "string", "minLength": 1 }
      }
    },
    "directMapping": {
      "type": "object",
      "additionalProperties": false,
      "required": ["typescript", "targets"],
      "properties": {
        "typescript": { "type": "string", "minLength": 1 },
        "targets": {
          "type": "array",
          "minItems": 1,
          "uniqueItems": true,
          "items": { "type": "string", "minLength": 1 }
        },
        "lean": {
          "type": "array",
          "uniqueItems": true,
          "items": { "type": "string", "minLength": 1 }
        },
        "receiverName": { "type": "string", "minLength": 1 },
        "note": { "type": "string", "minLength": 1 }
      }
    },
    "propertyMapping": {
      "type": "object",
      "additionalProperties": false,
      "required": ["typescript", "accessors"],
      "properties": {
        "typescript": { "type": "string", "minLength": 1 },
        "accessors": {
          "type": "object",
          "additionalProperties": false,
          "minProperties": 1,
          "properties": {
            "get": { "$ref": "#/$defs/accessorOperation" },
            "set": { "$ref": "#/$defs/accessorOperation" }
          }
        },
        "note": { "type": "string", "minLength": 1 }
      }
    },
    "accessorOperation": {
      "oneOf": [
        { "$ref": "#/$defs/accessorMapping" },
        { "$ref": "#/$defs/missingAccessor" }
      ]
    },
    "accessorMapping": {
      "type": "object",
      "additionalProperties": false,
      "required": ["target", "lean"],
      "properties": {
        "target": { "type": "string", "minLength": 1 },
        "lean": { "type": "string", "minLength": 1 },
        "receiverName": { "type": "string", "minLength": 1 },
        "parameterName": { "type": "string", "minLength": 1 }
      }
    },
    "missingAccessor": {
      "type": "object",
      "additionalProperties": false,
      "required": ["missing", "note"],
      "properties": {
        "missing": { "const": true },
        "note": { "type": "string", "minLength": 1 }
      }
    },
    "upstream": {
      "type": "object",
      "additionalProperties": false,
      "required": ["kind"],
      "allOf": [
        {
          "if": {
            "properties": { "kind": { "const": "typescript" } },
            "required": ["kind"]
          },
          "then": { "required": ["declarations", "roots"] }
        },
        {
          "if": {
            "properties": { "kind": { "const": "local" } },
            "required": ["kind"]
          },
          "then": { "required": ["declarations", "roots"] }
        },
        {
          "if": { "required": ["sourceUrl"] },
          "then": { "properties": { "declarations": { "type": "array", "maxItems": 1 } } }
        }
      ],
      "properties": {
        "kind": { "enum": ["typescript", "local", "internal"] },
        "package": { "type": "string", "minLength": 1 },
        "version": { "type": "string", "minLength": 1 },
        "declarations": {
          "type": "array",
          "minItems": 1,
          "uniqueItems": true,
          "items": { "type": "string", "minLength": 1 }
        },
        "sourceUrl": { "type": "string", "minLength": 1 },
        "roots": {
          "type": "array",
          "minItems": 1,
          "uniqueItems": true,
          "items": { "type": "string", "minLength": 1 }
        },
        "dependencyDepth": { "type": "integer", "minimum": 0 },
        "dependencyPolicy": {
          "type": "array",
          "items": { "$ref": "#/$defs/dependencyPolicySymbol" }
        },
        "docs": { "type": "string", "minLength": 1 }
      }
    },
    "dependencyPolicySymbol": {
      "type": "object",
      "additionalProperties": false,
      "required": ["id", "shape"],
      "properties": {
        "id": { "type": "string", "minLength": 1 },
        "display": { "type": "string", "minLength": 1 },
        "reason": { "type": "string", "minLength": 1 },
        "shape": { "type": "object" },
        "source": {
          "type": "object",
          "additionalProperties": false,
          "required": ["path", "startLine", "startColumn", "endLine", "endColumn"],
          "properties": {
            "path": { "type": "string", "minLength": 1 },
            "startLine": { "type": "integer", "minimum": 1 },
            "startColumn": { "type": "integer", "minimum": 1 },
            "endLine": { "type": "integer", "minimum": 1 },
            "endColumn": { "type": "integer", "minimum": 1 },
            "url": { "type": "string", "minLength": 1 }
          }
        }
      }
    }
  }
}
